question,text
What is machine learning ?, Machine learning is the discipline where the logic is driven by the data and the data are used for regression
What is supervised learning ?,Supervised learning is done by having labeled data and different features. The labeled data are used to predict which kind of data the next record is
what is clustering ?,Clustering is a 'grouping' of data by one or more features
Who was Adolf Hitler ?,Adolf Hitler was the reigning man in Germany 1933-1945 he was a cruel dictator and ruled with cruelty and as a despot
Who was Franz Kaffka ?,Kaffka was a Czech writer who wrote his books / novels in german language two of the most famous novels are 'Der Prozess' and 'Die Verwandlung'
Who was George Orwell ?,George Orwell was a english writer his most famous work was the novel 1984 about a 'big brother' controlling all the life in society
What is REXX ? ,"REXX is a system interpreter developed originally for IBM Host machines to do scripting like with EXEC, EXEC2 and JCL but much more comfortable written by a IBM fellow it is now a language with several paradigms like object oriented , imperative and partly nearly functional elements  "
What is PL/1 ?,"PL/1 is a high level compiler developed by IBM in the early 1960's. It is influenced by COBOL, FORTRAN and ALGOL. The very first version was a bootstrap compiler written in EXEC "
Who is John McCarthy ?,"John McCarthy (September 4, 1927 – October 24, 2011) was an American computer scientist and cognitive scientist. He was one of the founders of the discipline of artificial intelligence,[1] and part of just a small group of artificial intelligence researchers in the 1950s and 1960s.[2] He co-authored the proposal for the Dartmouth workshop which coined the term ""artificial intelligence"" (AI), led the development of the symbolic programming language family Lisp and had a large influence in the language ALGOL, popularized time-sharing, and created garbage collection.[3]"
Who were the Beatles ?,"The Beatles were an English rock band formed in Liverpool in 1960. The band comprised John Lennon, Paul McCartney, George Harrison and Ringo Starr. They are regarded as the most influential band in popular music and were integral to the development of 1960s counterculture and the recognition of popular music as an art form.[3][4] Rooted in skiffle, beat and 1950s rock 'n' roll, their sound incorporated elements of classical music and traditional pop in innovative ways. "
What is ABBA ?,"ABBA is a legendary Swedish pop group formed in 1972, comprising members Agnetha Fältskog, Björn Ulvaeus, Benny Andersson, and Anni-Frid Lyngstad. Known for global hits like ""Dancing Queen"" and ""Waterloo,"" they became one of the best-selling acts in music history after winning the 1974 Eurovision Song Contest."
Who was Mozart ?,"Wolfgang Amadeus Mozart[a][b] (27 January 1756 – 5 December 1791) was a Classical composer and musician. He completed more than 800 works in his life—including outstanding examples of most of the genres of his time: symphonies, concertos, chamber music, opera, and choral music."
Who was Beethoven ?,"Ludwig van Beethoven[n 1] (baptised 17 December 1770 – 26 March 1827) was a German composer and pianist. Mentored during the Classical period, Beethoven's musical style was a key driver of the transition to Romantic music, and the expansion of popular forms such as the symphony and string quartet. His compositions have attracted casual and scholarly interest, and remain among the most performed in the world."
What means Watergate scandal ?,"The Watergate scandal, or simply Watergate, was a political scandal in the United States involving the administration of President Richard Nixon. On June 17, 1972, operatives associated with Nixon's 1972 re-election campaign were caught burglarizing and planting listening devices in the Democratic National Committee headquarters at Washington, D.C.'s Watergate complex. Nixon's efforts to conceal his administration's involvement led to an impeachment process and his resignation in August 1974."
Who was Konrad Zuse ?,Konrad Ernst Otto Zuse (/ˈzuːsə/;[5] German: [ˈkɔnʁaːt ˈtsuːzə]; 22 June 1910 – 18 December 1995) was a German civil engineer
Who developed the first Linux ?,Linus Benedict Torvalds[a] (born 28 December 1969) is a Finnish and American software engineer who is the creator and lead developer of the Linux kernel since 1991. He also created the distributed version control system Git.
What is OS/2 ?,"OS/2 (Operating System/2) is a proprietary computer operating system for x86 and PowerPC based personal computers created and initially developed jointly by IBM and Microsoft, under the leadership of IBM software designer Ed Iacobucci,[2] intended as a replacement for DOS. The first version was released in 1987. A feud between the two companies beginning in 1990 led to Microsoft's leaving development solely to IBM, which continued development on its own. OS/2 Warp 4 in 1996 was the last major upgrade, after which IBM slowly halted the product as it failed to compete against Microsoft's Windows; updated versions of OS/2 were released by IBM until 2001."
What is the so called K&R C ?,"K&R C refers to the original dialect of the C programming language described in the first edition of the book The C Programming Language (1978) by Brian Kernighan and Dennis Ritchie. It was the de facto standard for C before ANSI C (C89) was established, characterized by looser syntax and ""old-style"" function definitions."
What is segment offset RAM addressing ?,"Segment:offset RAM addressing is a memory management technique, primarily used in x86 real mode, that calculates a 20-bit physical address by combining a 16-bit segment (base address) and a 16-bit offset (relative position). The segment is shifted left by 4 bits and added to the offset, allowing 16-bit systems to access 1MB of RAM"
Who was Stalin,Joseph Vissarionovich Stalin[e][f] (né Dzhugashvili;[g] 18 December [O.S. 6 December] 1878 – 5 March 1953) was a Soviet revolutionary and politician who led the Soviet Union from 1924 until his death in 1953. He held office as general secretary of the Communist Party from 1922 to 1952 and as premier from 1941 until his death.
What was the Holocaust ?  ,"The Holocaust was the systematic, state-sponsored persecution and murder of approximately six million European Jews by the Nazi regime and its allies between 1933 and 1945. Initiated by Adolf Hitler, this genocide aimed to eliminate the entire Jewish population, resulting in the killing of nearly seven out of every 10 Jews in Europe."
What is a Hollerith Machine and who developed it ? ,"During the 1930s and 1940s, Hollerith machines were the best data processing devices available. The Nazi regime employed thousands of people in 1933 to 1939 to record national census data onto Hollerith punch cards. The SS used the Hollerith machines during the war to monitor the large numbers of prisoners shipped in and out of concentration camps. The machines were manufactured by DEHOMAG-Deutsche Hollerith Maschinen Gesellschaft or German Hollerith Machine Company, a subsidiary of IBM since 1922."
What is a RNN in deep learning ?,"A Recurrent Neural Network (RNN) is a type of deep learning model designed to process sequential data—like text, speech, or time series—by retaining a ""memory"" of previous inputs. Unlike traditional feedforward networks, RNNs use loops to pass information from earlier steps to current steps, making them ideal for understanding context and ordering."
What is a CNN in deep learning ?,"A Convolutional Neural Network (CNN) is a type of deep learning model designed to process grid-like data, such as images, by automatically learning spatial patterns and features. They are the foundation of modern computer vision, using filters to detect edges, textures, and objects without manual feature engineering."
What is a F-Sore metric ?,"The F-score (or F-measure) is a machine learning metric that evaluates a binary classification model by calculating the harmonic mean of its precision and recall. Ranging from 0 to 1 (best), it provides a balanced measure of accuracy, particularly when dealing with imbalanced datasets where accuracy alone is misleadin"
What is the eucledian distance ?,"Euclidean distance is the straight-line distance between two points in Euclidean space, representing the shortest possible path. Calculated using the Pythagorean theorem, it measures the length of a segment connecting points, commonly used in machine learning (k-NN, k-means) and data analysis to determine proximity."
"What is a confusion matrix and TP, FP, TN, FN ?","This performance evaluation criteria task is an important step in both machine learning and data sciences. Hallmark measures including True Positive (TP), True Negative (TN), False Positive (FP) and False Negative (FN) are very useful in quantifying the effectiveness of the model that has been developed. Several metrics are available, and from the popular python library scikit-learn, arguably the best library for data scientists, we can obtain these metrics to assess the accuracy of model predictions. These metrics help data scientists understand how well their models can make accurate predictions, then optimise them for different or specific decisions, consequently improving the decision-making capability within diverse fields."
Who was Konrad Adenauer ?,"Konrad Hermann Joseph Adenauer[b] (5 January 1876 – 19 April 1967) was a German statesman and politician who served as the first chancellor of West Germany from 1949 to 1963. From 1946 to 1966, he was the first leader of the Christian Democratic Union (CDU), a newly founded Christian democratic party, which became the dominant force in the country under his leadership. Adenauer is considered one of the founding fathers of the European Union."
Who was Walter Scheel ?,"Walter Scheel (German: [ˈvaltɐ ˈʃeːl] ⓘ; 8 July 1919 – 24 August 2016)[1] was a German statesman. A former member of the Nazi Party who joined the Free Democratic Party of Germany (FDP) in 1946, he first served in government as the Federal Minister of Economic Cooperation and Development from 1961 to 1966 and later as President of Germany from 1974 to 1979. He led the FDP from 1968 to 1974.[2]"
Who was Theodor Heuss ?,"Theodor Heuss (German: [ˈteːodoːɐ̯ ˈhɔʏs] ⓘ; 31 January 1884 – 12 December 1963) was a German politician who served as the first president of West Germany from 1949 to 1959. His civil demeanour and cordial nature – somewhat a contrast to German nationalist traditions and the stern character of chancellor Konrad Adenauer – largely contributed to the stabilisation of democracy in West Germany during the Wirtschaftswunder years. Before beginning his career as a politician, Heuss had been a political journalist.[1] Heuss is remembered as a major representative of social liberalism in Germany.[2]"
Who was Helmut Kohl ?,"Helmut Josef Michael Kohl[b] (3 April 1930 – 16 June 2017) was a German politician who served as chancellor of Germany and governed the Federal Republic from 1982 to 1998. He was leader of the Christian Democratic Union (CDU) from 1973 to 1998 and oversaw the end of the Cold War, the German reunification and the creation of the European Union (EU). Kohl's 16-year tenure is the longest in German post-war history and is the longest for any democratically elected chancellor of Germany."
Who was Helmut Schmidt ?,"Helmut Heinrich Waldemar Schmidt (German: [ˈhɛlmuːt ˈʃmɪt] ⓘ; 23 December 1918 – 10 November 2015) was a German politician and member of the Social Democratic Party of Germany (SPD), who served as the chancellor of West Germany from 1974 to 1982. He was the longest lived chancellor in German history and had the longest post-chancellorship, at over 33 years."
Who was Willy Brandt ?,Willy Brandt (German: [ˈvɪliː ˈbʁant] ⓘ; born Herbert Ernst Karl Frahm; 18 December 1913 – 8 October 1992) was a German politician and statesman who was leader of the Social Democratic Party of Germany (SPD) from 1964 to 1987 and concurrently served as the chancellor of West Germany from 1969 to 1974.[1] He was awarded the Nobel Peace Prize in 1971 for his efforts to strengthen cooperation in Western Europe through the EEC and to achieve reconciliation between West Germany and the countries of Eastern Europe.[2] He was the first Social Democratic chancellor since 1930.[3]
Who was Hans Dietrich Genscher ?,"Hans-Dietrich Genscher (German: [ˈɡɛnʃɐ]; 21 March 1927 – 31 March 2016) was a German statesman and a member of the liberal Free Democratic Party (FDP), who served as Federal Minister of the Interior from 1969 to 1974, and as Federal Minister for Foreign Affairs and Vice Chancellor of Germany from 1974 to 1992 (except for a two-week break in 1982, after the FDP had left the Third Schmidt cabinet), making him the longest-serving occupant of either post and the only person to have held one of these positions under two different Chancellors of the Federal Republic of Germany. In 1991 he was chairman of the Organization for Security and Co-operation in Europe (OSCE)."
Who is Joschka Fisher ?,"Joseph Martin ""Joschka"" Fischer (born 12 April 1948) is a German former politician of the Alliance 90/The Greens party. He served as the foreign minister and as the vice chancellor of Germany in the cabinet of Gerhard Schröder from 1998 to 2005. Fischer has been a leading figure in the German Greens since the 1970s, and according to opinion polls,[1] he was the most popular politician in Germany for most of the Schröder government's duration. Following the September 2005 election, in which the Schröder government was defeated, he left office on 22 November 2005. In September 2010, he supported the creation of the Spinelli Group, a Europarliamentarian initiative founded with a view to reinvigorate efforts to federalise the European Union."
Who is Angela Merkel ?,Angela Dorothea Merkel[a][b] (née Kasner; born 17 July 1954) is a German stateswoman and retired politician who served as Chancellor of Germany from 2005 to 2021. She is the only woman to have held the office and the only from former East Germany. She was Leader of the Opposition from 2002 to 2005 and Leader of the Christian Democratic Union (CDU) from 2000 to 2018.
Who is Friedrich Merz ?,"Friedrich Merz[a] (born 11 November 1955) is a German politician who has served as Chancellor of Germany since 6 May 2025. He has also served as Leader of the Christian Democratic Union (CDU) since January 2022, leading the CDU/CSU (Union) parliamentary group as Leader of the Opposition in the Bundestag from February 2022 to May 2025. The worst chancellor of Germany ever !!!! No other chancellor had so bad statistics"
Who was Winston Churchill ?,"Sir Winston Leonard Spencer Churchill[a] (30 November 1874 – 24 January 1965) was a British statesman, military officer, and writer who was Prime Minister of the United Kingdom from 1940 to 1945, during the Second World War, and again from 1951 to 1955. For some 62 of the years between 1900 and 1964, he was a Member of Parliament (MP) and represented a total of five constituencies over that time. Ideologically an adherent to economic liberalism and imperialism, he was for most of his career a member of the Conservative Party, which he led from 1940 to 1955. He was a member of the Liberal Party from 1904 to 1924. No sports only whiskey and cigars"
What is Queen with Freddy Mercury ?,"reddie Mercury (born Farrokh Bulsara; 5 September 1946 – 24 November 1991) was a British singer and songwriter who achieved global fame as the lead vocalist and pianist of the rock band Queen. Regarded as one of the greatest singers in the history of rock music, he is known for his flamboyant stage persona and four-octave vocal range. Mercury defied the conventions of a rock frontman with his theatrical style, influencing the artistic direction of Queen."
What was little bird ?,The nuclear bomb thrown on Hiroshima
